{
  "type": "page",
  "title": "示例页面",
  "whetherYouCanDrag": true,
  "props": {
    "className": "PageContainer",
    "style": ""
  },
  "children": [
    {
      "componentName": "div容器",
      "type": "container",
      "icon": "icon-fuxuankuangkong",
      "group": "基础组件",
      "key": "container-001",
      "props": {
        "className": "container",
        "style": "",
        "divProps": {
          "title": "容器属性",
          "children": [
            { "key": "display", "label": "布局方式", "type": "segmented", "value": "flex", "options": [
              { "label": "grid", "value": "grid" },
              { "label": "flex", "value": "flex" }
            ]}
          ]
        },
        "titleProps": {
          "title": "标题",
          "children": [
            { "key": "title", "label": "标题", "type": "input", "value": "我的容器" }
          ]
        }
      },
      "children": []
    }
  ]
}
